product,description,ad,category
Palazzo pants," Wide flowing pants with a relaxed fit, offering comfort and style in one package.","Discover unparalleled comfort & style with our Palazzo pants! Perfectly wide & flowing, these relaxed-fit wonders effortlessly elevate your wardrobe. Shop now & embrace the best of both worlds!",clothes
Double-breasted blazer," A jacket featuring two parallel rows of buttons, creating a sophisticated, polished look.","Refine your style with our elegant double-breasted blazer - boasting two parallel rows of buttons, sophistication and polish await. Transform your wardrobe today! #FashionUpgrade #SophisticatedLook",clothes
Leather biker jacket," A cropped, fitted jacket in leather material, featuring edgy details like zippers and studs.","Discover the ultimate edgy-chic look with our leather biker jacket! Fitted & cropped, it boasts rockin' zippers and studs. Unleash your inner rebel today. Elevate your wardrobe – ride with style!",clothes
Sheer blouse," A semi-transparent blouse, perfect for layering over a camisole or bralette.","Discover effortless elegance with our Sheer Blouse - semi-transparent, lightweight, perfect for layering. Pair with your favorite camisole or bralette for a chic look that makes a statement. Shop now!",clothes
Cowl-neck sweater," A sweater featuring a draped, fold-over neckline, adding warmth and softness.","Stay cozy & stylish this season with our Cowl-neck Sweaters! Embrace elegance in a draped, fold-over neckline that keeps you warm & snug. Limited stock. Get yours now!",clothes
Oversized scarf," A large, wrap-style scarf that can be styled in various ways to add depth and interest to an outfit.","Discover limitless style with our versatile Oversized Scarf! Wrap, drape, or tie to elevate any outfit - the ultimate accessory for chic comfort. Shop now & transform your wardrobe!",clothes
Smartphone,"A versatile device that combines communication, entertainment, and productivity in one compact gadget.","Stay connected, entertained, and productive with our Smartphone – your world in your pocket!",electronics
Wireless Earbuds,"Compact, wireless earbuds offering high-quality sound and noise cancellation for an immersive audio experience.",Cut the cords and elevate your sound with our Wireless Earbuds – freedom meets premium audio!,electronics
Electric Car,"An eco-friendly vehicle powered by electricity, offering a smooth and silent driving experience with zero emissions.","Drive into the future with our Electric Car – sustainable, stylish, and smart!",cars
Smart Speaker,"A voice-activated speaker that plays music, answers questions, and controls smart home devices with ease.","Your voice, your command – experience seamless control with our Smart Speaker!",electronics
Laptop,"A portable computer designed for work, study, and entertainment, offering powerful performance in a sleek design.","Power up your productivity with our Laptop – work smarter, anywhere, anytime!",electronics
Smartwatch,"A wearable device that tracks fitness, monitors health, and keeps you connected with notifications on your wrist.","Stay ahead with our Smartwatch – your health, your time, your style!",electronics
Electric Scooter,"A lightweight, eco-friendly scooter perfect for short commutes, offering convenience and fun in urban environments.","Zip through the city with our Electric Scooter – fast, fun, and eco-friendly!",electronics
Robot Vacuum Cleaner,"An automated vacuum that cleans your floors effortlessly, saving you time and energy.","Let our Robot Vacuum Cleaner do the dirty work – clean floors, zero effort!",cleaning
4K Smart TV,"A high-definition television with smart features, offering stunning visuals and access to endless entertainment.","Experience the ultimate viewing with our 4K Smart TV – crystal-clear visuals, endless entertainment!",electronics
Portable Power Bank,"A compact device that charges your phone and other gadgets on the go, ensuring you never run out of battery.",Stay powered up anywhere with our Portable Power Bank – never miss a moment!,electronics
Organic Honey,"Pure, natural honey sourced from organic beehives, rich in flavor and packed with health benefits.","Sweeten your life the natural way with our Organic Honey – pure, golden goodness!",food
Gourmet Coffee Beans,"Premium coffee beans roasted to perfection, offering a rich and aromatic coffee experience.",Wake up to luxury with our Gourmet Coffee Beans – every sip is a masterpiece!,food
Artisanal Bread,"Handcrafted bread made with high-quality ingredients, offering a rustic and wholesome taste.","Savor the tradition with our Artisanal Bread – baked with love, enjoyed with passion!",food
Extra Virgin Olive Oil,"Cold-pressed olive oil with a rich, fruity flavor, perfect for cooking and drizzling.",Elevate your dishes with our Extra Virgin Olive Oil – the essence of the Mediterranean!,food
Dark Chocolate Bar,A rich and indulgent dark chocolate bar made with high cocoa content for a luxurious treat.,Indulge in the rich taste of our Dark Chocolate Bar – a moment of pure bliss!,food
Organic Granola,"A crunchy and nutritious blend of oats, nuts, and dried fruits, perfect for a healthy breakfast or snack.","Start your day right with our Organic Granola – wholesome, delicious, and energizing!",food
Cold-Pressed Juice,"Fresh, nutrient-packed juice made from cold-pressed fruits and vegetables for maximum flavor and health benefits.",Refresh and recharge with our Cold-Pressed Juice – nature’s goodness in every sip!,food
Plant-Based Protein Shake,"A delicious and nutritious shake made from plant-based proteins, perfect for post-workout recovery or a quick meal.","Fuel your body with our Plant-Based Protein Shake – powerful nutrition, plant-powered goodness!",food
Gourmet Pasta Sauce,"A rich and flavorful sauce made from ripe tomatoes and fresh herbs, perfect for enhancing your pasta dishes.","Transform your meals with our Gourmet Pasta Sauce – authentic taste, homemade love!",food
Organic Tea Blends,"A selection of finely crafted tea blends made from organic herbs and leaves, offering a soothing and aromatic experience.","Unwind with our Organic Tea Blends – pure, calming, and delicious!",food
Electric SUV,"A spacious and eco-friendly SUV powered by electricity, offering a smooth ride and advanced technology","Drive the future with our Electric SUV – power, space, and sustainability combined!",cars
Sports Coupe,"A sleek and high-performance coupe designed for speed enthusiasts, offering thrilling acceleration and precision handling.",Feel the adrenaline with our Sports Coupe – where speed meets style!,cars
Pickup Truck,"A rugged and versatile truck built for heavy-duty tasks, offering unmatched durability and towing capacity",Tackle any challenge with our Pickup Truck – strength and reliability you can count on!,cars
Hybrid Car,A fuel-efficient car that combines a gasoline engine with an electric motor for reduced emissions and better mileage.,Go green without compromise with our Hybrid Car – efficiency meets performance!,cars
Luxury Sedan,"A premium sedan offering a luxurious interior, advanced safety features, and a smooth, comfortable ride.",Experience elegance on the road with our Luxury Sedan – sophistication in every detail!,cars
Off-road Jeep,A rugged and capable off-road vehicle designed to conquer any terrain with ease.,Explore the unbeaten path with our Off-road Jeep – adventure awaits!,cars
Compact Car,"A small and efficient car perfect for city driving, offering great fuel economy and easy maneuverability.","Navigate the city with ease in our Compact Car – smart, efficient, and stylish!",cars
Classic Muscle Car,"A powerful and iconic car with a roaring engine, designed for those who love raw power and classic design.",Relive the glory days with our Classic Muscle Car – power and nostalgia in one ride!,cars
Convertible,"A stylish and fun-to-drive car with a retractable roof, perfect for enjoying sunny days and open roads.",Feel the freedom with our Convertible – where every drive is an adventure!,cars
Interactive Robot Toy,"A smart robot that interacts with kids through voice commands, games, and educational activities.","Meet your child’s new best friend – our Interactive Robot Toy, where learning meets fun!",toys
Building Blocks Set,"A classic set of colorful blocks that encourage creativity, problem-solving, and fine motor skills.","Build, create, and imagine with our Building Blocks Set – endless possibilities in every block!",toys
Remote-Controlled Car,"A fast and durable RC car with easy controls, perfect for indoor and outdoor play.","Race into action with our Remote-Controlled Car – speed, control, and excitement in your hands!",toys
Plush Stuffed Animal,"A soft and cuddly stuffed animal, perfect for comforting and imaginative play.",Snuggle up with our Plush Stuffed Animal – your child’s new favorite companion!,toys
STEM Science Kit,"An educational kit that introduces kids to science, technology, engineering, and math through fun experiments.",Spark curiosity with our STEM Science Kit – where learning becomes an adventure!,toys
Dollhouse with Furniture," A detailed dollhouse with miniature furniture, encouraging imaginative play and storytelling.",Create a world of imagination with our Dollhouse – where every room tells a story!,toys
Electric Train Set,"A complete train set with tracks, locomotives, and accessories for hours of creative play.",All aboard for fun with our Electric Train Set – the ultimate adventure on rails!,toys
Outdoor Play Tent,"A colorful and easy-to-assemble tent for indoor or outdoor play, perfect for adventures and hideouts.",Unleash your child’s imagination with our Outdoor Play Tent – a world of adventure awaits!,toys
Musical Instrument Set,"A set of child-friendly musical instruments, including drums, xylophone, and maracas, to inspire young musicians.","Let the music play with our Musical Instrument Set – rhythm, fun, and creativity in every note!",toys
Puzzle Set,"A collection of puzzles with varying difficulty levels, designed to challenge and entertain kids of all ages.",Piece together the fun with our Puzzle Set – where every challenge is a triumph!,toys
Modern Sofa Bed,"A stylish and versatile sofa that transforms into a comfortable bed, perfect for small spaces.",Style meets functionality with our Modern Sofa Bed – perfect for lounging and sleeping!,furniture
Minimalist Dining Table,"A sleek and simple dining table made from high-quality materials, ideal for modern interiors.","Elevate your dining experience with our Minimalist Dining Table – where simplicity meets elegance!""",furniture
Ergonomic Office Chair,A comfortable and adjustable chair designed to support posture during long hours of work.,Work in comfort with our Ergonomic Office Chair – productivity starts here!,furniture
Rustic Wooden Bookshelf,"A sturdy and stylish bookshelf made from reclaimed wood, adding a touch of rustic charm to any room.",Organize in style with our Rustic Wooden Bookshelf – timeless beauty for your home!,furniture
Convertible Coffee Table,A multifunctional coffee table that can be adjusted to different heights and configurations.,Transform your living space with our Convertible Coffee Table – versatility at its best!,furniture
Luxury King-Size Bed,"A spacious and luxurious bed with a plush mattress and elegant frame, ensuring a restful night’s sleep.",Sleep like royalty with our Luxury King-Size Bed – comfort and style combined!,furniture
Compact Folding Desk,"A space-saving desk that folds away when not in use, perfect for small apartments or home offices.","Maximize your space with our Compact Folding Desk – work smart, live better!",furniture
Outdoor Patio Set,A durable and stylish set of chairs and a table designed for outdoor relaxation and entertaining.,Enjoy the outdoors with our Outdoor Patio Set – perfect for sunny days and cozy evenings!,furniture
Vintage Armchair,"A beautifully crafted armchair with a vintage design, adding a touch of elegance to any room.",Add a touch of class with our Vintage Armchair – timeless comfort and style!,furniture
Modular Shelving Unit,A customizable shelving system that can be arranged in various configurations to fit your space and needs.,Organize your way with our Modular Shelving Unit – flexibility and style in one!,furniture
Running Shoes,Lightweight and durable shoes designed for optimal performance and comfort during running.,Step up your run with our Running Shoes – where every stride feels effortless!,clothes
Yoga Mat,"A non-slip, eco-friendly yoga mat that provides cushioning and stability for your practice.",Find your balance with our Yoga Mat – perfect for every pose and stretch!,sport
Adjustable Dumbbells,"Space-saving dumbbells with adjustable weights, ideal for a full-body workout at home.",Transform your fitness routine with our Adjustable Dumbbells – strength training made simple!,sport
Cycling Helmet,A lightweight and aerodynamic helmet designed for safety and comfort during cycling.,Ride safe and stylish with our Cycling Helmet – protection meets performance!,sport
Fitness Tracker," A wearable device that monitors your activity, heart rate, and sleep to help you stay on track with your fitness goals.",Track your progress with our Fitness Tracker – your personal coach on your wrist!,sport
Resistance Bands Set,"A set of durable resistance bands for strength training, stretching, and rehabilitation exercises.","Boost your workout with our Resistance Bands Set – versatile, portable, and effective!",sport
Treadmill,A high-performance treadmill with adjustable speed and incline settings for a complete cardio workout at home.,"Run anytime, anywhere with our Treadmill – your path to fitness starts here!",sport
Sports Water Bottle,durable and leak-proof water bottle designed to keep you hydrated during workouts.,Stay hydrated and focused with our Sports Water Bottle – essential for every athlete!,sport
Boxing Gloves,"High-quality gloves designed for boxing and MMA, offering excellent protection and comfort.","Train like a champion with our Boxing Gloves – power, precision, and protection!",sport
Portable Basketball Hoop,An adjustable and portable basketball hoop perfect for practicing your shots at home or on the go.,Shoot hoops anytime with our Portable Basketball Hoop – fun and fitness in one!,sport
LED Christmas Lights,Energy-efficient LED lights in various colors and patterns to brighten up your holiday decorations.,"Light up your holidays with our LED Christmas Lights – festive, bright, and eco-friendly!",holidays
Artificial Christmas Tree,A realistic and easy-to-assemble artificial tree that brings the holiday spirit into your home,Celebrate in style with our Artificial Christmas Tree – the perfect centerpiece for your holiday decor!,holidays
Holiday Wreath,"A beautifully crafted wreath made from evergreen branches, pinecones, and festive ornaments.",Welcome the season with our Holiday Wreath – a timeless symbol of holiday cheer!,holidays
Christmas Stockings,"Festive stockings in various designs, perfect for hanging by the fireplace and filling with gifts.",Stuff them with joy using our Christmas Stockings – a holiday tradition for everyone!,holidays
Holiday Scented Candles,"Candles with festive scents like pine, cinnamon, and gingerbread to create a cozy holiday atmosphere.",Set the mood with our Holiday Scented Candles – the essence of Christmas in every flicker!,holidays
Christmas Ornament Set,A collection of beautifully designed ornaments to decorate your tree and home.,Deck the halls with our Christmas Ornament Set – sparkle and shine for the holidays!,holidays
Festive Tableware Set,"A complete set of plates, cups, and napkins featuring holiday designs for your festive meals.",Celebrate in style with our Festive Tableware Set – perfect for holiday gatherings!,holidays
Holiday Throw Blanket,"A cozy and soft blanket with holiday patterns, perfect for snuggling up by the fire.",Stay warm and festive with our Holiday Throw Blanket – comfort and cheer in every thread!,holidays
Christmas Village Set,A charming collection of miniature houses and figures to create a magical holiday village display.,Build a winter wonderland with our Christmas Village Set – a festive centerpiece for your home!,holidays
Advent Calendar,A traditional calendar with 24 doors  each hiding a small treat or gift to count down to Christmas.,Count down to Christmas with our Advent Calendar – a daily dose of holiday joy!,holidays
Gourmet Chocolate Truffles,"Luxurious, handcrafted truffles with rich, creamy centers and a variety of decadent coatings.",Indulge in luxury with our Gourmet Chocolate Truffles – a bite of pure bliss!,food
Assorted Gummy Bears,"Chewy and flavorful gummy bears in a rainbow of fruity flavors, perfect for snacking.","Taste the rainbow with our Assorted Gummy Bears – fun, fruity, and irresistible!",food
Salted Caramel Chocolate Bar,A smooth milk chocolate bar filled with gooey salted caramel for the perfect sweet and salty combination.,"Satisfy your cravings with our Salted Caramel Chocolate Bar – sweet, salty, and oh-so-delicious!",food
Vanilla Bean Macarons,"Delicate and airy macarons with a rich vanilla bean filling, perfect for a sophisticated treat.",Experience elegance with our Vanilla Bean Macarons – a taste of Paris in every bite!,food
Peanut Butter Cups,"Creamy peanut butter encased in smooth milk chocolate, offering a perfect balance of flavors.",Peanut butter lovers rejoice with our Peanut Butter Cups – a classic treat you’ll adore!,food
Fruit-Filled Bonbons,"Soft, chewy candies with a burst of fruity filling in the center, available in a variety of flavors.","Discover a fruity surprise with our Fruit-Filled Bonbons – chewy, juicy, and delightful!",food
Dark Chocolate Covered Almonds,"Crunchy almonds coated in rich, dark chocolate for a healthy yet indulgent snack.",Crunch into happiness with our Dark Chocolate Covered Almonds – a perfect balance of health and indulgence!,food
Caramel Popcorn,"Sweet and buttery caramel-coated popcorn, perfect for movie nights or snacking on the go.",Pop into sweetness with our Caramel Popcorn – the ultimate snack for any occasion!,food
Mint Chocolate Chip Cookies,Soft and chewy cookies with a refreshing mint flavor and rich chocolate chips.,"Refresh your taste buds with our Mint Chocolate Chip Cookies – cool, minty, and chocolatey!",food
Strawberry Cheesecake Bites,Bite-sized treats combining the creamy richness of cheesecake with the sweetness of strawberries.,Savor the flavor with our Strawberry Cheesecake Bites – a little bite of heaven!,food
Non-Stick Frying Pan,"A durable and easy-to-clean frying pan with a non-stick surface, perfect for cooking a variety of dishes.","Cook with ease using our Non-Stick Frying Pan – perfect meals, every time!",kitchen
Electric Stand Mixer,"A powerful and versatile mixer for baking and cooking, with multiple attachments for various tasks.","Mix, knead, and whip with our Electric Stand Mixer – your ultimate kitchen companion",kitchen
Chef's Knife Set,"A high-quality set of knives designed for precision cutting, slicing, and dicing.","Slice like a pro with our Chef's Knife Set – sharp, reliable, and essential for every kitchen!",kitchen
Air Fryer,"A compact and efficient appliance that fries food with little to no oil, offering a healthier alternative to traditional frying.","Fry healthier with our Air Fryer – crispy, delicious, and guilt-free!",kitchen
Food Processor,"A versatile kitchen appliance for chopping, slicing, shredding, and pureeing ingredients quickly and easily.","Simplify your prep with our Food Processor – fast, efficient, and multifunctional!",kitchen
Cast Iron Skillet,"A heavy-duty skillet that provides even heat distribution, perfect for searing, frying, and baking.","Cook with tradition using our Cast Iron Skillet – durable, versatile, and timeless!",kitchen
Blender,"A powerful blender for making smoothies, soups, sauces, and more, with easy-to-clean components.","Blend your way to deliciousness with our Blender – smooth, creamy, and perfect every time!",kitchen
Silicone Baking Mats,"Reusable, non-stick mats for baking, offering an eco-friendly alternative to parchment paper.","Bake smarter with our Silicone Baking Mats – non-stick, reusable, and easy to clean!",kitchen
Electric Pressure Cooker,"A multi-functional cooker that speeds up meal preparation with pressure cooking, slow cooking, and more.",Cook faster and smarter with our Electric Pressure Cooker – meals made easy!,kitchen
Glass Food Storage Containers,"Durable and eco-friendly containers for storing leftovers, meal prepping, and organizing your kitchen.","Store and organize with our Glass Food Storage Containers – fresh, safe, and sustainable!",kitchen
Decorative Throw Pillows,Stylish and comfortable pillows in various colors and patterns to add a pop of color and texture to your sofa.,Refresh your space with our Decorative Throw Pillows – comfort meets style!,kitchen
Wall Art Canvas,Beautifully designed canvas prints that add a touch of elegance and personality to your walls.,Transform your walls with our Wall Art Canvas – art that speaks to your soul!,furniture
Area Rug,A soft and durable rug that adds warmth and style to your living room floor.,"Anchor your space with our Area Rug – cozy, stylish, and perfect for any room!",furniture
Decorative Vases,"Elegant vases in various shapes and sizes, perfect for displaying fresh flowers or as standalone decor.",Elevate your decor with our Decorative Vases – timeless beauty for your home!,furniture
Floor Lamp,A sleek and modern floor lamp that provides both ambient lighting and a stylish focal point.,Light up your space with our Floor Lamp – functional and fashionable!,furniture
Decorative Mirrors,Stylish mirrors that not only reflect light but also serve as stunning decorative pieces.,Add depth and style with our Decorative Mirrors – reflect your unique taste!,furniture
Coffee Table Books,A collection of beautifully illustrated books that add a touch of sophistication to your coffee table.,"Accessorize your space with our Coffee Table Books – art, culture, and conversation starters!",furniture
Indoor Plants,"Lush, low-maintenance plants that bring a touch of nature and freshness to your living room.",Bring life to your space with our Indoor Plants – natural beauty for your home!,furniture
Decorative Candle Holders,Elegant candle holders that add a warm and inviting ambiance to your living room.,Set the mood with our Decorative Candle Holders – light up your evenings in style!,furniture
Accent Chairs,Stylish and comfortable chairs that add a splash of color and extra seating to your living room.,Complete your look with our Accent Chairs – comfort and style in every detail!,furniture
Decorative Wall Shelves,"Stylish and functional shelves to display books, plants, and decorative items, adding both storage and charm to your walls.",Organize and decorate with our Decorative Wall Shelves – a perfect blend of form and function!,furniture
Statement Clock,A bold and artistic wall clock that serves as both a timepiece and a striking decorative element.,Make a statement with our Statement Clock – timekeeping with a touch of art!,furniture
Decorative Throw Blankets,"Soft and cozy blankets in various textures and patterns, perfect for adding warmth and style to your sofa.",Snuggle in style with our Decorative Throw Blankets – comfort meets elegance!,furniture
Decorative Trays,"Elegant trays for organizing and displaying items on your coffee table or console, adding a touch of sophistication",Organize with elegance using our Decorative Trays – style and functionality in one!,furniture
Decorative Lanterns,"Stylish lanterns that can hold candles or LED lights, creating a warm and inviting atmosphere.",Illuminate your space with our Decorative Lanterns – a cozy glow for any room!,furniture
Wall Decals,"Easy-to-apply and removable wall decals in various designs, perfect for adding a personal touch to your walls.",Personalize your space with our Wall Decals – creativity at your fingertips!,furniture
Decorative Figurines,Artistic figurines that add a unique and personal touch to your shelves or tables.,Add character to your space with our Decorative Figurines – art that tells a story!,furniture
Decorative Curtains,"Stylish curtains in various fabrics and patterns, perfect for adding color and texture to your windows.",Frame your windows with our Decorative Curtains – elegance and privacy combined!,furniture
Decorative Room Dividers,Beautiful and functional dividers that create separate spaces while adding a decorative element to your room.,Define your space with our Decorative Room Dividers – style and functionality in one!,furniture
Decorative Table Lamps,Elegant table lamps that provide soft lighting and add a touch of sophistication to your side tables or console.,Light up your decor with our Decorative Table Lamps – ambiance and style in every glow!,furniture
Digital Thermometer,"A fast and accurate thermometer for measuring body temperature, featuring a digital display for easy reading.","Stay informed with our Digital Thermometer – quick, accurate, and reliable!",health
Blood Pressure Monitor,"An easy-to-use device for monitoring blood pressure at home, helping you keep track of your cardiovascular health.",Take control of your health with our Blood Pressure Monitor – precise and convenient!,health
