product,description,ad,category
First Aid Kit,A comprehensive kit containing essential supplies for treating minor injuries and emergencies.,Be prepared for anything with our First Aid Kit – safety and peace of mind in one box!,health
Pulse Oximeter,"A compact device that measures blood oxygen levels and heart rate, essential for monitoring respiratory health.","Monitor your health with our Pulse Oximeter – quick, accurate, and portable!",health
Compression Socks,Therapeutic socks designed to improve circulation and reduce swelling in the legs and feet.,Step into comfort with our Compression Socks – support and relief for your legs!,health
Nebulizer,"A medical device that turns liquid medication into a mist for easy inhalation, ideal for respiratory conditions.",Breathe easier with our Nebulizer – effective relief for respiratory issues!,health
Orthopedic Pillow,A specially designed pillow that supports proper spinal alignment and reduces neck pain.,Sleep better with our Orthopedic Pillow – comfort and support for a restful night!,health
Medical Gloves,"Disposable gloves made from latex or nitrile, providing protection and hygiene for medical procedures.",Stay protected with our Medical Gloves – essential for safety and hygiene!,health
Reusable Hot/Cold Pack,"A versatile pack that can be heated or cooled to provide relief for pain, swelling, or muscle soreness.",Soothe your aches with our Reusable Hot/Cold Pack – comfort and relief whenever you need it!,health
Wheelchair,A lightweight and foldable wheelchair designed for easy mobility and comfort for those with limited mobility.,Regain your independence with our Wheelchair – mobility and comfort in one!,health
Wireless Bluetooth Speaker,"A portable speaker that connects wirelessly to your devices, delivering high-quality sound for music and more.","Take your music anywhere with our Wireless Bluetooth Speaker – powerful sound, portable convenience!",health
Soundbar,"A sleek and compact soundbar that enhances your TV audio with rich, immersive sound.",Elevate your entertainment with our Soundbar – cinematic sound in your living room!,health
Noise-Canceling Headphones,"Premium headphones that block out external noise, offering an immersive listening experience.",Immerse yourself in sound with our Noise-Canceling Headphones – pure audio bliss!,health
Portable Record Player,A compact and stylish record player that lets you enjoy your vinyl collection anywhere.,"Rediscover vinyl with our Portable Record Player – classic sound, modern convenience!",electronics
Smart Speaker with Voice Assistant,"A voice-activated speaker that plays music, answers questions, and controls smart home devices.","Your voice, your command – enjoy seamless control with our Smart Speaker!",electronics
Home Theater System,A complete audio system with multiple speakers and a subwoofer for a surround sound experience.,Bring the cinema home with our Home Theater System – immersive sound for every movie night!,electronics
Wireless Earbuds,Compact and wireless earbuds offering high-quality sound and noise cancellation for on-the-go listening.,Cut the cords and elevate your sound with our Wireless Earbuds – freedom meets premium audio!,electronics
Karaoke Machine,A fun and easy-to-use machine that turns your living room into a karaoke stage.,Sing your heart out with our Karaoke Machine – the ultimate party starter!,electronics
Portable PA System,"A powerful and portable public address system, perfect for events, presentations, and outdoor gatherings.","Amplify your voice with our Portable PA System – clear, powerful sound wherever you go!",electronics
Hi-Fi Stereo System,A high-fidelity stereo system that delivers crystal-clear audio for music enthusiasts.,"Experience music like never before with our Hi-Fi Stereo System – pure, uncompromised sound!",electronics
Reclining Armchair,"A comfortable and stylish armchair with a reclining feature, perfect for relaxing after a long day.",Relax in style with our Reclining Armchair – ultimate comfort at your fingertips!,furniture
Console Table,"A sleek and narrow table designed for entryways or behind sofas, offering both functionality and style.",Welcome guests in style with our Console Table – elegance and practicality combined!,furniture
Bar Cabinet,": A stylish cabinet designed to store and display your drinks and glassware, perfect for entertaining.","Entertain with flair using our Bar Cabinet – your home bar, beautifully organized!",furniture
Ottoman with Storage,"A versatile ottoman that provides extra seating, footrest, and hidden storage space.","Maximize your space with our Ottoman – comfort, style, and storage in one!",furniture
Bookshelf,A sturdy and stylish bookshelf designed to organize and display your book collection and decor items.,Organize your world with our Bookshelf – a perfect blend of function and style!,furniture
Dining Bench,"A long, sturdy bench that provides additional seating at your dining table, perfect for family gatherings.",Gather around with our Dining Bench – stylish seating for everyone!,furniture
Accent Cabinet,"A decorative cabinet that adds storage and style to any room, available in various finishes and designs.",Add a touch of elegance with our Accent Cabinet – storage and style in one piece!,furniture
Daybed,"A versatile piece of furniture that serves as both a sofa and a bed, perfect for lounging or hosting guests.",Relax and unwind with our Daybed – comfort and versatility in one!,furniture
Media Console,"A sleek and functional console designed to hold your TV and media devices, with ample storage for accessories.",Organize your entertainment with our Media Console – sleek design meets functionality!,electronics
Folding Screen,A decorative and functional screen that can be used to divide spaces or add a touch of elegance to your room.,Define your space with our Folding Screen – style and privacy in one!,furniture
Electric Kettle,"A fast and efficient kettle for boiling water, perfect for tea, coffee, and cooking.","Boil water in seconds with our Electric Kettle – quick, convenient, and stylish!",kitchen
Herb Scissors,Specialized scissors with multiple blades for quickly and efficiently chopping herbs.,"Chop herbs in seconds with our Herb Scissors – fast, easy, and efficient!",kitchen
Kitchen Scale,"A precise digital scale for measuring ingredients, ensuring accuracy in your recipes.",Measure with precision using our Kitchen Scale – essential for every baker and chef!,kitchen
Silicone Baking Cups,"Reusable and non-stick baking cups, perfect for muffins, cupcakes, and other baked goods.",Bake smarter with our Silicone Baking Cups – eco-friendly and easy to clean!,kitchen
Rice Cooker,"An appliance that cooks rice perfectly every time, with settings for different types of rice and grains",Perfect rice made easy with our Rice Cooker – set it and forget it!,kitchen
Digital Camera,A high-quality camera that captures stunning photos and videos with advanced features and settings.,Capture every moment with our Digital Camera – professional quality in your hands!,electronics
Photo Printer,A compact printer that produces high-quality photo prints from your digital images.,Bring your memories to life with our Photo Printer – vibrant prints at your fingertips!,electronics
Photo Album,A beautifully designed album to store and display your cherished photos.,Preserve your memories with our Photo Album – timeless and elegant!,electronics
Camera Bag,A durable and stylish bag designed to protect and carry your camera and accessories.,Carry your gear in style with our Camera Bag – protection and convenience combined!,electronics
Tripod,"A sturdy and adjustable stand to stabilize your camera for sharp, clear photos and videos.",Steady your shots with our Tripod – perfect stability for every photo!,electronics
Photo Frame,A decorative frame to showcase your favorite photos in style.,Display your memories with our Photo Frame – elegance for every picture!,electronics
Memory Card,A high-capacity storage card for saving your photos and videos with fast transfer speeds.,Store more memories with our Memory Card – reliable and fast!,electronics
Photo Editing Software,Advanced software for editing and enhancing your photos with professional tools and effects.,Transform your photos with our Photo Editing Software – creativity at your fingertips!,electronics
Photo Scanner,"A device that digitizes your old photos, preserving them for future generations.",Preserve the past with our Photo Scanner – digitize your memories with ease!,electronics
Photo Lightbox,A portable lightbox that provides perfect lighting for photographing small objects and products.,Perfect your product shots with our Photo Lightbox – professional lighting made easy!,electronics
Backpack,A durable and ergonomic backpack designed for comfort and convenience during travel.,Explore the world with our Travel Backpack – comfort and style for every adventure!,camping
Travel Pillow,A comfortable and supportive pillow designed for restful sleep during flights or long journeys.,Sleep soundly with our Travel Pillow – comfort on the go!,camping
Luggage Set,A stylish and durable set of suitcases with smooth-rolling wheels and secure locks.,Travel in style with our Luggage Set – durability and elegance combined!,camping
Travel Adapter,A versatile adapter that allows you to plug in your devices in different countries.,"Stay powered worldwide with our Travel Adapter – one adapter, endless possibilities!",camping
Portable Water Filter,A compact and efficient filter that ensures you have access to clean drinking water anywhere.,Stay hydrated anywhere with our Portable Water Filter – clean water on the go!,furniture
Travel Journal,"A beautifully designed journal to document your travels, memories, and experiences.","Capture your adventures with our Travel Journal – your story, beautifully told!",jewelry
Pearl Stud Earrings,Classic and timeless earrings featuring genuine pearls for a sophisticated look.,Elevate your elegance with our Pearl Stud Earrings – timeless beauty for every occasion. Shop now and add a touch of sophistication to your style!,jewelry
Gold Hoop Earrings,Stylish and versatile gold hoops that add a touch of glamour to any outfit.,"Make a statement with our Gold Hoop Earrings – the perfect blend of style and versatility. Perfect for day or night, these hoops are a must-have!",jewelry
Silver Pendant Necklace,A delicate silver necklace with a minimalist pendant for a subtle yet chic look.,Discover the beauty of simplicity with our Silver Pendant Necklace – a delicate touch to elevate your everyday style. Shop now and embrace understated elegance!,jewelry
Rose Gold Bracelet,A sleek rose gold bracelet that adds a modern and feminine touch to your wrist.,"Add a touch of modern femininity with our Rose Gold Bracelet – sleek, stylish, and perfect for any occasion. Elevate your wrist game today!",jewelry
Diamond Tennis Bracelet,A luxurious bracelet featuring a continuous line of sparkling diamonds.,Shine bright with our Diamond Tennis Bracelet – a timeless piece that exudes luxury and elegance. Perfect for special occasions or everyday glamour. Shop now!,jewelry
Moonstone Ring,"A unique ring featuring a mesmerizing moonstone, perfect for bohemian style.",Channel your inner bohemian with our Moonstone Ring – a unique and mesmerizing piece that adds a mystical touch to your look. Shop now and embrace the magic!,jewelry
Layered Chain Necklace,A trendy necklace featuring multiple delicate chains for a layered look.,Stay on-trend with our Layered Chain Necklace – the perfect accessory to add depth and style to any outfit. Layer up and elevate your look today!,jewelry
Opal Drop Earrings,Elegant earrings featuring stunning opal stones that catch the light beautifully.,Turn heads with our Opal Drop Earrings – a stunning blend of elegance and sophistication. Perfect for adding a touch of glamour to any outfit. Shop now!,jewelry
Turquoise Statement Ring,"A bold ring featuring a vibrant turquoise stone, perfect for making a statement.",Make a bold statement with our Turquoise Statement Ring – a vibrant and eye-catching piece that adds a pop of color to your look. Shop now and stand out!,jewelry
Crystal Chandelier Earrings,Glamorous earrings featuring cascading crystals for a dramatic and elegant look.,Step into the spotlight with our Crystal Chandelier Earrings – the ultimate accessory for adding drama and elegance to any outfit. Perfect for special occasions!,jewelry
Gold Bangle Set,A set of gold bangles that can be stacked or worn individually for a chic look.,"Stack up the style with our Gold Bangle Set – versatile, chic, and perfect for any occasion. Mix and match to create your unique look. Shop now!",jewelry
Sapphire Cocktail Ring,A bold and luxurious ring featuring a stunning sapphire stone for a pop of color.,Add a splash of color with our Sapphire Cocktail Ring – a bold and luxurious piece that’s perfect for making a statement. Shop now and embrace the elegance!,jewelry
Minimalist Gold Ring,"A simple yet elegant gold ring, perfect for everyday wear.",Keep it simple and stylish with our Minimalist Gold Ring – a timeless piece that complements any outfit. Perfect for everyday elegance. Shop now!,jewelry
Enamel Charm Bracelet,A playful bracelet featuring colorful enamel charms for a fun and trendy look.,Add a pop of color to your wrist with our Enamel Charm Bracelet – a fun and trendy accessory that’s perfect for expressing your unique style. Shop now and let your personality shine!,jewelry
Emerald Cut Diamond Earrings,Elegant earrings featuring emerald-cut diamonds for a sophisticated and timeless look.,Experience timeless elegance with our Emerald Cut Diamond Earrings – a sophisticated addition to your jewelry collection. Perfect for special occasions or everyday luxury. Shop now!,jewelry
Beaded Anklet,"A delicate anklet featuring colorful beads, perfect for summer or beachwear.",Get ready for summer with our Beaded Anklet – a delicate and colorful accessory that’s perfect for beach days or casual outings. Shop now and add a touch of fun to your look!,jewelry
Silver Cuff Bracelet,A bold and modern silver cuff bracelet that adds an edgy touch to any outfit.,Make a bold statement with our Silver Cuff Bracelet – a modern and edgy accessory that’s perfect for adding a touch of attitude to your look. Shop now and embrace your inner rebel!,jewelry
Garnet Pendant Necklace,"A stunning necklace featuring a deep red garnet stone, perfect for adding a touch of drama.",Add a touch of drama to your look with our Garnet Pendant Necklace – a stunning piece that’s perfect for making a statement. Shop now and embrace the boldness!,jewelry
Rose Gold Ear Cuff,A trendy ear cuff that wraps around your ear for a unique and modern look.,Stay ahead of the trends with our Rose Gold Ear Cuff – a unique and modern accessory that’s perfect for adding a touch of edge to your style. Shop now and embrace the future of fashion!,jewelry
Crystal Stud Earrings,"Elegant earrings featuring sparkling crystals, perfect for adding a touch of glamour.","Add a touch of sparkle to your look with our Crystal Stud Earrings – elegant, timeless, and perfect for any occasion. Shop now and shine bright!",jewelry
Silicone Spatula Set,A set of heat-resistant silicone spatulas perfect for baking and cooking.,"Upgrade your kitchen with our Silicone Spatula Set – heat-resistant, durable, and perfect for all your cooking needs. Shop now and make cooking a breeze!",kitchen
Non-Stick Baking Mat,A reusable baking mat that ensures even baking and easy cleanup.,"Bake smarter with our Non-Stick Baking Mat – reusable, eco-friendly, and perfect for cookies, pastries, and more. Say goodbye to messy baking sheets!",kitchen
Garlic Press,A sturdy garlic press that minces garlic quickly and efficiently.,"Make mincing garlic a breeze with our Garlic Press – durable, easy to clean, and perfect for adding flavor to your dishes. Shop now and elevate your cooking!",kitchen
Kitchen Shears,"Multi-purpose scissors designed for cutting herbs, meat, and packaging.","Cut through anything with our Kitchen Shears – versatile, sharp, and perfect for all your kitchen tasks. A must-have for every home chef!",kitchen
Measuring Cups and Spoons,A set of precise measuring cups and spoons for accurate ingredient measurements.,Measure with precision using our Measuring Cups and Spoons – essential for every baker and chef. Perfect for creating delicious recipes every time!,kitchen
Vegetable Spiralizer,A tool that turns vegetables into spiralized noodles for healthy meals.,"Get creative in the kitchen with our Vegetable Spiralizer – perfect for making healthy, low-carb meals. Spiralize your way to better eating today!",kitchen
Cast Iron Grill Pan,A heavy-duty grill pan that provides even heat distribution for perfect grilling.,"Grill like a pro with our Cast Iron Grill Pan – perfect for steaks, veggies, and more. Enjoy restaurant-quality meals at home!",kitchen
Silicone Baking Cups,"Reusable and non-stick baking cups for muffins, cupcakes, and more.","Bake smarter with our Silicone Baking Cups – eco-friendly, easy to clean, and perfect for all your baking needs. Say goodbye to paper liners!",kitchen
Electric Can Opener,A convenient electric can opener that opens cans with ease.,"Open cans effortlessly with our Electric Can Opener – quick, easy, and perfect for any kitchen. Say goodbye to manual can openers!",kitchen
Mandoline Slicer,A versatile slicer for cutting vegetables and fruits into perfect slices.,"Slice like a pro with our Mandoline Slicer – perfect for salads, garnishes, and more. Create restaurant-quality dishes at home!",kitchen
Meat Thermometer,A digital thermometer for checking the internal temperature of meat.,"Cook meat to perfection with our Meat Thermometer – accurate, easy to use, and essential for every home chef. Never overcook again!",kitchen
Silicone Oven Mittens,Heat-resistant silicone mittens for safe handling of hot pots and pans.,"Protect your hands with our Silicone Oven Mittens – heat-resistant, durable, and perfect for all your cooking needs. Shop now and cook with confidence!",kitchen
Stainless Steel Colander,"A durable colander for draining pasta, vegetables, and more.","Drain with ease using our Stainless Steel Colander – sturdy, easy to clean, and perfect for all your kitchen needs. A must-have for every home cook!",kitchen
Kitchen Scale,A digital scale for precise measurement of ingredients.,Measure with precision using our Kitchen Scale – essential for baking and cooking. Perfect for creating delicious recipes every time!,kitchen
Silicone Lid Set,A set of stretchable silicone lids that fit various bowl sizes.,"Keep your food fresh with our Silicone Lid Set – stretchable, reusable, and perfect for covering bowls of all sizes. Say goodbye to plastic wrap!",kitchen
Potato Masher,A sturdy masher for making smooth mashed potatoes and other dishes.,"Create creamy mashed potatoes with our Potato Masher – durable, easy to use, and perfect for all your mashing needs. Shop now and elevate your side dishes!",kitchen
Adjustable Rolling Pin,A rolling pin with adjustable thickness guides for perfect dough rolling.,"Roll dough like a pro with our Adjustable Rolling Pin – perfect for pies, cookies, and more. Achieve the perfect thickness every time!",kitchen
Silicone Whisk,A heat-resistant silicone whisk for mixing and beating ingredients.,"Mix and whisk with ease using our Silicone Whisk – heat-resistant, durable, and perfect for all your cooking needs. Shop now and make cooking a breeze!",kitchen
Egg Separator,A simple tool for separating egg yolks from whites.,Separate eggs effortlessly with our Egg Separator – perfect for baking and cooking. A must-have for every home chef!,kitchen
Herb Stripper,A tool for quickly stripping herbs from their stems.,Prep herbs in seconds with our Herb Stripper – perfect for cooking and garnishing. Make meal prep faster and easier!,kitchen
Camping Tent,A durable and weather-resistant tent for comfortable outdoor sleeping.,"Sleep under the stars with our Camping Tent – durable, weather-resistant, and easy to set up. Perfect for your next outdoor adventure!",camping
Sleeping Bag,A warm and comfortable sleeping bag designed for various weather conditions.,"Stay cozy on your camping trips with our Sleeping Bag – lightweight, warm, and perfect for all seasons. Shop now and sleep comfortably in the great outdoors!",camping
Portable Camping Stove,A compact and efficient stove for cooking meals while camping.,"Cook delicious meals in the wild with our Portable Camping Stove – compact, easy to use, and perfect for any outdoor adventure. Shop now and elevate your camping experience!",camping
Camping Lantern,A bright and energy-efficient lantern for lighting up your campsite.,"Light up your campsite with our Camping Lantern – bright, durable, and perfect for nighttime adventures. Shop now and never be left in the dark!",camping
Folding Camping Chair,A lightweight and portable chair for comfortable seating at the campsite.,"Relax in comfort with our Folding Camping Chair – lightweight, portable, and perfect for any outdoor setting. Shop now and make your camping experience more enjoyable!",camping
Cooler Box,An insulated cooler for keeping food and drinks cold during camping trips.,"Keep your food and drinks fresh with our Cooler Box – insulated, durable, and perfect for long camping trips. Shop now and enjoy cold refreshments wherever you go!",camping
Camping Hammock,A lightweight and portable hammock for relaxing between trees.,"Relax in nature with our Camping Hammock – lightweight, easy to set up, and perfect for a peaceful retreat. Shop now and add comfort to your outdoor adventures!",camping
Portable Water Filter,A compact filter for purifying water from natural sources while camping.,"Stay hydrated safely with our Portable Water Filter – compact, efficient, and perfect for purifying water from streams and lakes. Shop now and explore worry-free!",camping
Multi-Tool Knife,A versatile tool with various functions for camping and outdoor activities.,"Be prepared for anything with our Multi-Tool Knife – versatile, durable, and essential for every camping trip. Shop now and tackle any challenge!",camping
Camping Table,A foldable and portable table for meals and activities at the campsite.,"Make your campsite more functional with our Camping Table – foldable, lightweight, and perfect for meals and games. Shop now and enhance your outdoor experience!",camping
Headlamp,A hands-free light source for nighttime activities and emergencies.,"Keep your hands free with our Headlamp – bright, adjustable, and perfect for nighttime adventures. Shop now and light up your path!",camping
Camping Cookware Set,"A compact set of pots, pans, and utensils for cooking while camping.","Cook like a pro in the wild with our Camping Cookware Set – compact, durable, and perfect for outdoor meals. Shop now and make camping cuisine a delight!",camping
Inflatable Sleeping Pad,A comfortable and portable pad for a better night's sleep while camping.,"Sleep comfortably with our Inflatable Sleeping Pad – lightweight, easy to inflate, and perfect for any terrain. Shop now and wake up refreshed!",camping
Camping Shower,A portable shower for staying clean during extended camping trips.,"Stay fresh on your camping trips with our Camping Shower – portable, easy to use, and perfect for outdoor hygiene. Shop now and enjoy the comforts of home in the wild!",camping
Fire Starter Kit,A reliable kit for starting campfires in any weather condition.,"Start your campfire with ease using our Fire Starter Kit – reliable, weather-resistant, and perfect for any outdoor adventure. Shop now and keep warm under the stars!",camping
Portable Power Bank,A high-capacity power bank for charging devices while camping.,"Stay connected with our Portable Power Bank – high-capacity, durable, and perfect for charging your devices in the wild. Shop now and never run out of power!",camping
Camping Axe,A sturdy axe for chopping wood and preparing campfires.,"Prepare your campfire with ease using our Camping Axe – sturdy, reliable, and perfect for chopping wood. Shop now and make your camping experience more enjoyable!",camping
Mosquito Net,A protective net to keep insects away while sleeping or relaxing.,"Keep bugs at bay with our Mosquito Net – lightweight, easy to set up, and perfect for a peaceful night's sleep. Shop now and enjoy bug-free camping!",camping
Camping Tarp,A durable and waterproof tarp for shelter and ground cover.,"Stay dry and protected with our Camping Tarp – waterproof, durable, and perfect for creating extra shelter. Shop now and be prepared for any weather!",camping
Portable Toilet,A compact and hygienic toilet for camping in remote areas.,"Stay comfortable and hygienic with our Portable Toilet – compact, easy to use, and perfect for remote camping. Shop now and enjoy the convenience of a toilet anywhere!",camping
Pet Carrier Backpack,A comfortable and ventilated backpack for transporting small pets.,"Take your furry friend anywhere with our Pet Carrier Backpack – comfortable, secure, and perfect for adventures. Shop now and explore the world together!",pets
Automatic Feeder,A programmable feeder that dispenses food at set times for your pet.,"Never miss a meal with our Automatic Feeder – programmable, reliable, and perfect for busy pet owners. Shop now and keep your pet well-fed!",pets
