product,description,ad,category
Harem pants," A style of pants with a dropped crotch, loose-fitting legs, and a gathered waistband for a unique, bohemian look.","Discover Harem Pants! Unique, stylish bohemian vibes with a dropped crotch & loose legs. Comfy meets chic - elevate your wardrobe. Limited stock - shop now!",clothes
Fringe skirt," A skirt featuring fringe detailing on the bottom, creating movement and fun.","Introducing our fabulous Fringe Skirt! Step out in style with eye-catching fringe detailing that adds flair and movement. Perfect for any occasion, create unforgettable memories with this chic piece.",clothes
Gingham dress," A dress featuring a two-toned checkered pattern, often associated with picnics and summery outfits.","Introducing the Gingham Dress: Timeless & Chic! 💕 Step into summer with this must-have, two-toned checkered dress. From picnics to parties, it's your go-to look. Shop now for unbeatable style!",clothes
Duster coat," A long, lightweight coat that falls below the knee, offering an elongated silhouette.",Discover unparalleled style & comfort with our Duster Coats - the perfect blend of chic & lightweight design for a sleek silhouette that falls below the knee. Elevate your wardrobe now!,clothes
Henley shirt," A collarless, button-up shirt with a small placket, offering a casual yet stylish look.","Discover timeless style & unbeatable comfort with our Henley shirts! Casual meets chic in these collarless, button-up wonders. Elevate your wardrobe - Shop now! Limited stock.",clothes
Metallic pleated skirt," A skirt featuring narrow, accordion-like pleats and a shiny, metallic finish.","Discover the stunning Metallic Pleated Skirt - chic, accordion-style pleats meet a lustrous metallic finish for a fashion-forward look that dazzles. Elevate your wardrobe now!",clothes
Fishnet stockings," Hosiery with an open, diamond-shaped knit, adding an edgy and daring element.",Introducing our daring Fishnet Stockings🔥Transform your look with the edgy diamond-knit hosiery that adds a bold touch to any outfit💃Perfect for date nights and girls' night out🌙Shop now & turn heads!,clothes
Pencil skirt," A knee-length, slim-fitting skirt that hugs the hips and tapers slightly at the bottom.","Introducing the Pencil Skirt: Elegance meets comfort with this knee-length, slim-fitting skirt. Hugging your hips and gently tapering at the bottom, it's perfect for any occasion. Upgrade your wardrobe now!",clothes
Sequined dress," A dress embellished with numerous sequins, providing sparkle and glamour.",Discover unparalleled sparkle & glamour with our new Sequined Dress! Turn heads and make unforgettable memories at your next event. Shop now for the ultimate show-stopping look!,clothes
Sheath dress," A tailored, knee-length dress that is slim-fitting and designed to follow the body's natural contours.","Discover sleek sophistication with our tailored Sheath Dress - a figure-flattering, knee-length stunner that hugs your curves and exudes effortless elegance. Embrace your inner fashionista today.",clothes
Boatneck blouse," A wide, shallow neckline that extends from shoulder to shoulder, creating a classic and feminine look.","Discover elegance redefined with our timeless Boatneck Blouse - the perfect blend of a classic wide neckline & feminine charm, crafted for your ultimate style statement! Shop now!",clothes
Leopard-print blouse," A blouse featuring an animal print pattern, adding a touch of wild sophistication.",Unleash your inner wild side with our Leopard-print blouse! This chic animal print adds sophistication to any outfit. A must-have addition to your wardrobe. Shop now and make a statement!,clothes
Zipper-detail jeans," Jeans featuring zipper accents or closures, adding an edgy and modern touch.","Upgrade your denim game! Introducing Zipper-detail Jeans - where style meets edge. Make a bold statement with added zipper accents & closures. Get yours today, stand out in the crowd.",clothes
Maxi dress," A floor-length dress offering a dramatic, elegant look, perfect for formal occasions or casual wear.","Discover elegance in every step with our Maxi Dress👗. Effortlessly stylish for casual or formal occasions, this floor-length stunner is perfect for turning heads👀 wherever you go! Upgrade your wardrobe now!",clothes
Bomber jacket," A short, durable jacket with a ribbed collar and cuffs, based on the classic military design.","Discover the perfect blend of style & durability! Get our Bomber Jacket - a classic military-inspired masterpiece, boasting a ribbed collar & cuffs for that extra edge. Upgrade your wardrobe now!",clothes
Slouchy beanie," A relaxed, oversized knitted hat that can be worn casually or to keep warm in cooler weather.",Discover the cozy Slouchy Beanie - your ultimate cold-weather accessory! Stay effortlessly stylish and warm in our oversized knit hat for a laid-back yet fashionable look. Get yours now!,clothes
Shift dress," A loose, knee-length dress that doesn't cling to the body, providing a versatile and flattering silhouette.",Discover the perfect blend of style & comfort with our Shift Dress - the ultimate wardrobe staple that flatters every shape! Shop now for a versatile & chic knee-length steal. Say hello to effortless elegance.,clothes
Chunky knit sweater," A thick, textured sweater knitted with a heavier yarn, perfect for cozy layering.","Stay warm this season with our Chunky Knit Sweater! Thick, textured & perfect for cozy layering. Unbeatable comfort & style wrapped into one. Shop now & snuggle up!",clothes
Crop top," A short top that ends above the waist, offering a playful and contemporary look.","""Stay ahead in style with our chic Crop Tops! ✨ Show off your playful side & flaunt a contemporary look. Elevate any outfit - Get yours today! 🔥 Limited stock. #CropTopLove #FashionForward""",clothes
Ikat-print scarf," A scarf featuring a traditional, dyeing technique that creates distinctive, blurred geometric patterns.","Discover our Ikat-print scarf, blending tradition & style with its unique dyeing technique, showcasing stunning blurred geometric patterns. Elevate any outfit - Shop now!",clothes
Sweatshirt," A casual, pullover top made from soft fabric, often featuring a bold graphic or pattern.","Stay cozy and stylish with our soft, graphic sweatshirts! Perfect for laid-back days or making a bold statement. Shop now for your new wearable art top! Don't miss out! #SweatshirtLove",clothes
Jacquard skirt," A fabric featuring a raised, woven design, creating an intricate and luxurious skirt.",Discover elegance in our luxurious Jacquard skirt! Adorned with a lavish raised woven design for an intricate & lavish style. Shop now & elevate your wardrobe instantly!,clothes
Quilted vest," A sleeveless, insulated vest featuring a quilted design, ideal for layering in cooler weather.","Discover our sleek Quilted Vest! Sleeveless, insulated & perfect for layering in cool weather. Elevate your style game while staying cozy. Get yours now & embrace the chill!",clothes
Capri pants," Three-quarter length pants that end mid-calf, perfect for a casual summer ensemble.","Upgrade your summer wardrobe with our stylish Capri pants! Ideal for casual outings, these three-quarter length pants end mid-calf, ensuring comfort and chic all season long. Shop now and stay on-trend!",clothes
Wide-leg trousers," Pants with a loose and flowing fit, creating an elongated and sophisticated silhouette.","Introducing our Wide-Leg Trousers: Effortlessly chic and endlessly versatile. Discover a flattering, comfortable fit that creates an elegant, elongated silhouette. Elevate your style today!",clothes
Peplum blouse," A fitted blouse with a flared ruffle at the waist, adding extra dimension and interest.","Discover elegance with our Peplum Blouse! Fitted design meets a flared waist ruffle, perfect for adding dimension & interest to your outfit. Shop now to upgrade your wardrobe with timeless style.",clothes
Utility jacket," A durable, often oversized jacket featuring multiple pockets and a structured, military-inspired design.","Introducing the Utility Jacket: Military-inspired design meets ultimate functionality. Oversized and durable, featuring ample pockets for all your on-the-go essentials. Get yours now and take on any day with style and efficiency!",clothes
High-low dress," A dress with a hemline that is higher at the front and lower at the back, creating a dramatic, flowing effect.","Discover elegance with a twist in our stunning High-Low Dresses! Showcase your unique style with a hemline that rises at the front and falls at the back, making every step a showstopper. Shop now!",clothes
Embellished pumps," High-heeled shoes adorned with crystals, beads, or other ornate details.","Elevate your style to dazzling heights with our Embellished Pumps! Adorned with exquisite crystals & beads, these high-heels are the epitome of elegance. Step into glamour today!",clothes
Chenille sweater," A soft, plush sweater made from chenille fabric, providing warmth and comfort.",Introducing the Chenille Sweater: Experience ultimate warmth & comfort in our deluxe plush knitwear. Elegance meets coziness. Perfect for any occasion. Be stylish. Stay snug. Shop now!,clothes
Culottes," Wide-legged, cropped pants that offer a chic alternative to skirts and shorts.",Discover chic comfort with our stylish Culottes - combining the elegance of skirts & the ease of shorts. Wide-legged & cropped for a fashion-forward look. Shop now & redefine your wardrobe!,clothes
Tulle skirt," A voluminous skirt featuring multiple layers of tulle, perfect for creating a ballerina-inspired look.","Upgrade your wardrobe with our Tulle Extravaganza Skirt🌟! Twirl into a dream of fluffy layers, crafted for fashionable ballerina vibes✨. Get ready to be the center of attention and order now! #tulleskirt",clothes
Bermuda shorts,Knee-length shorts that offer a polished and conservative option for warmer weather.,"Stay cool & stylish in our Bermuda shorts! Perfectly tailored, knee-length for a polished look. Upgrade your warm-weather wardrobe now! Visit our store, limited stock available.",clothes
Suede jacket," A soft, textured jacket made from suede, adding luxe and sophistication.",Experience luxury & sophistication with our soft textured suede jacket. Elevate your style & turn heads wherever you go. Shop now for a trendy wardrobe upgrade!,clothes
One-shoulder top," A top that bares one shoulder, adding an asymmetrical and stylish element.","Discover the chic one-shoulder top that elevates your style effortlessly. Accentuate your allure with this asymmetrical marvel, showcasing both elegance and sophistication. Shop now and turn heads!",clothes
Faux fur vest," A sleeveless, fur-like garment, adding warmth and texture to any outfit.",Upgrade your wardrobe with a touch of luxury! Our Faux Fur Vest is the perfect sleeveless addition for style & warmth. Make a statement in any outfit - Get yours now! #StayStylishAndWarm,clothes
Riding boots," Tall, knee-high boots designed to protect the legs for equestrian activities, but versatile enough to be worn in everyday styling.","Discover timeless Riding Boots 🐎 Elegant knee-high protection for equestrians, yet versatile enough for everyday fashion. Get ready to saddle up in style! Shop now.",clothes
Embroidered jeans," Jeans featuring intricate, embroidered designs on the pockets, waistband or legs.","Discover stunning style in every stitch with our Embroidered Jeans collection! Adorn your wardrobe with intricate, one-of-a-kind designs on pockets, waistbands & legs. Elevate your denim game now!",clothes
Nautical-striped sweater," A classic, horizontally-striped sweater inspired by maritime pursuits.","Discover our timeless Nautical-striped Sweater! Exude maritime elegance with this classic, horizontal-striped design inspired by seafaring adventures. Set sail in style today. #AhoyChicFashion",clothes
Fit and flare dress," A dress that is fitted at the waist and flares out at the hips, creating a flattering, feminine silhouette.","Discover your new favorite style! Our Fit & Flare Dress accentuates the waist and gracefully flares at the hips, creating an elegant, feminine silhouette. Shop now for a timeless look!",clothes
Bodycon dress," A tight-fitting dress, highlighting curves and creating an ultra-sleek figure.","Introducing our Bodycon Dress! ✨ Flaunt your curves and make a bold statement in this ultra-sleek, figure-hugging masterpiece. Get ready to own the night! Shop now & turn heads. #SleekSensation 🛍️",clothes
Platform heels," Shoes with a raised sole and heel, offering height and comfort.",Step up your style game with our chic Platform Heels 👠! Boost your height & confidence while experiencing ultimate comfort. Walk tall & turn heads. Shop now! Limited stock & free shipping.,clothes
Mock-neck sweater," A pullover sweater with a high, close-fitting neckline that provides warmth and style.","Stay warm, look chic! Our Mock-neck Sweater is the perfect blend of cozy comfort and on-trend style. Don’t let the cold cramp your fashion game - Shop now and stand out from the crowd.",clothes
High-waist jeans," Full-length jeans with a waistband that sits right at the natural waist, accentuating curves and elongating the legs.","Discover high-waist jeans, perfect for flattering your figure! Embrace your curves and enjoy longer-looking legs with these stylish full-length wardrobe essentials. Shop now for a confident stride.",clothes
Windowpane-check shirt," A shirt featuring a large, grid-like pattern resembling windowpanes.","Discover timeless sophistication with our Windowpane-check Shirt. 🚫🙂 Made from high-quality fabric, its grid-like pattern ensures effortless style for both. 🛍️ Get yours now and redefine your wardrobe!",clothes
Choker necklace," A close-fitting necklace that sits snugly around the neck, adding a bold detail to any outfit.","""Revolutionize your style with our Choker necklace! This close-fitting accessory adds striking details to any outfit & accentuates your neckline. Elevate your wardrobe now! #FashionStatement""",clothes
Military-style jacket," A structured jacket inspired by historical military uniforms, featuring decorative buttons or epaulets.","Discover the power of style with our Military-inspired Jacket – structured, sharp, and ready to command attention. Adorned with decorative buttons & epaulets, it's time to march into fashion. Be Bold!",clothes
Camouflage pants," Pants featuring the classic camouflage pattern, offering a bold, urban look.",Discover bold & urban style with our Classic Camouflage Pants🔥Elevate your wardrobe & stand out on every adventure🌆Low stock alert📢Shop NOW before they're gone! #CamouflagePants #OwnYourStyle,clothes
Kaftan," A flowy, loose-fitting garment with wide sleeves, often worn as a dress or beach cover-up.","Discover your new summer essential! Our stylish Kaftans are perfect as chic dresses or beach cover-ups, featuring wide sleeves & a breezy fit. Get yours now and stay fashionably cool!",clothes
Tassel earrings,Dangling earrings featuring a playful tassel of threads or beads.,"Discover elegance with a twist! Our Tassel Earrings, the perfect blend of fashionable threads & beads, elevate your style! Limited stock! Don't miss them! Shop now!",clothes
Halter-neck top,A sleeveless top with a high neckline that ties or fastens at the back of the neck.,Introducing our chic Halter-neck Top! Perfect for a sleek day-to-night look. High neckline meets elegant tie-back design. Limited stock - Grab yours now at [website]! Free shipping on orders $50+!,clothes
Wrap dress," A dress with a front closure formed by folding one side over the other and tying at the waist, creating a flattering, adjustable shape.","Discover our stylish Wrap Dress - the perfect blend of fashion and function! With its adjustable front closure and figure-flattering waist tie, you'll feel confident and chic all day long. Get yours today!",clothes
Pinafore dress," A sleeveless dress with an apron-style front, perfect for layering over a blouse or sweater.","Upgrade your wardrobe with our chic Pinafore Dress! Layer it over a blouse or sweater for a versatile, stylish look. Sleeveless, apron-style front - Perfect for any occasion! Shop now.",clothes
Zebra-print coat," A coat featuring a black and white striped pattern, emulating the appearance of zebra stripes.",Unleash your wild side with our stunning Zebra-print coat! Bold black & white stripes guarantee turning heads. Quality & flair in one stunning piece. Dare to be fierce! Limited stock. Get yours today.,clothes
Tiered skirt," A skirt composed of multiple layers of fabric, creating a voluminous and eye-catching silhouette.","Discover elegance with our stunning Tiered Skirt! Designed with multiple layers of luxe fabric, this voluminous piece adds flair & style to any wardrobe. Elevate your look today - Shop Now!",clothes
Off-the-shoulder blouse," A romantic top that exposes the shoulders, providing a flattering and sensual style.",Discover romance in your wardrobe with our Off-the-shoulder Blouse. Mesmerizing style awaits; flaunt your shoulders with a captivating top that's both elegant & sensual. Find your perfect fit today.,clothes
Cigarette pants," Slim, ankle-length pants with a streamlined silhouette, perfect for business or casual wear.","Introducing Cigarette pants! Slim, ankle-length & stylish. Elevate business or casual attire with a sleek silhouette. Shop now for a versatile wardrobe essential. #CigarettePantsFashionUpgrade",clothes
Jumpsuit," A one-piece garment that combines a top and pants, offering a streamlined and fashionable look.",Upgrade your wardrobe with our chic Jumpsuit – the perfect blend of style and comfort. Our one-piece top & pants combo creates a sleek silhouette that's a must-have. Shop now - be effortlessly stylish!,clothes
Geometric-print maxi skirt," A floor-length skirt featuring bold, angular patterns for a modern, artistic look.",Introducing our Geometric-print Maxi Skirt: A unique fusion of modern art & style! Be the trendsetter with our floor-length skirt featuring bold angular patterns. Shop now & flaunt your artistic side!,clothes
Racerback tank," A sleeveless top with a T-shaped strap across the upper back, offering a sporty, casual look.",Introducing our trendy Racerback Tank! It's a stylish and sporty sleeveless top featuring a unique T-shaped strap design across the upper back. Get ready for comfort and compliments! Shop now.,clothes
Quilted handbag," A handbag with a quilted design, stitching pattern, and, often, made from soft leather or fabric.","Introducing our Quilted Handbags: The luxurious merger of style, comfort, and sophistication. Discover the ultimate accessory - crafted with premium fabrics and refined stitching patterns. Elevate your ensemble now!",clothes
Velvet blazer," A luxurious, soft blazer made from velvet material, perfect for dressing up or down.","Introducing the Velvet Blazer - Luxurious, soft, and versatile. Elevate your style for any occasion. Experience sheer elegance in every wear. Get yours now and embrace ultimate sophistication.",clothes
Plaid shirt,A classic button-up shirt featuring a bold or subtle plaid pattern.,Upgrade your wardrobe! Discover our Classic Button-Up Plaid Shirt: bold or subtle patterns for versatile style. Elevate your fashion game. Shop now!,clothes
Gladiator sandals," Strappy sandals with a bold, crisscross design, often featuring multiple buckles or ties.",Introducing Gladiator Sandals: Unleash your inner warrior with our bold crisscross design - Strut in style & comfort with multiple buckles/ties for a perfect fit. Step up your summer game now!,clothes
Skinny jeans,Tight-fitting jeans that hug the legs and accentuate the figure.,Discover our top-selling Skinny Jeans – designed to sculpt your figure and flatter every curve! Upgrade your wardrobe with jeans that fit impeccably & offer lasting style. Shop now!,clothes
Floral-print dress," A dress featuring a delicate, feminine floral pattern.","Introducing our Floral-Print Dress: Delicate & feminine, this beautifully crafted piece is perfect for any occasion. Experience style in full bloom now. #Fashion #FloralDress 🌸👗✨",clothes
Bolero-style jacket," A short, open-fronted jacket with a cropped hemline, perfect for layering over a dress or top.","Discover the versatile Bolero Jacket! Ideal for layering over dresses or tops, this chic, open-front cropped jacket elevates any outfit. Effortlessly stylish, comfortably classy. Get yours today!",clothes
Kimono-style robe," A loose, flowing robe with wide sleeves, inspired by traditional Japanese garments.","Unleash your inner elegance with our Kimono-style robe! Drift into tranquility with its loose, flowing design & wide sleeves. Embrace the marriage of tradition and modern sophistication. Shop now!",clothes
Mesh panel leggings," Leggings with sheer or semi-sheer mesh panels, offering ventilation and a sleek, modern look.","Upgrade your wardrobe with our Mesh Panel Leggings! Experience unmatched comfort & style while staying cool. Get ready to flaunt a chic, modern look! Shop now & embrace your fashion-forward side.",clothes
Trench coat," A classic, knee-length coat with a belted waist and double-breasted button front.","Introducing our timeless Trench Coat! Upgrade your wardrobe with this double-breasted, knee-length staple, featuring a belted waist for a flattering silhouette. Chic, versatile, essential. Get yours now!",clothes
Bell-sleeve blouse," A blouse featuring long sleeves that flare out towards the cuffs, creating a feminine and romantic look.",Discover elegance redefined with our Bell-sleeve blouse. Graceful flared cuffs create the perfect blend of sophistication & romance. Elevate your fashion game today - limited stock available!,clothes
Slip dress," A simple, elegant dress, often with thin straps and a V-neck, reminiscent of lingerie.","Discover timeless elegance with our chic Slip Dress. Featuring delicate thin straps, a graceful V-neck, and a design inspired by lingerie. Exude confidence and style today. Shop Now!",clothes
T-strap sandals," Flat or heeled sandals that have a central strap running from the front of the shoe to the ankle, mimicking the shape of a ""T"".","Step into elegance with our stunning T-strap sandals! Flat or heeled, experience comfort & style. Perfect for any occasion, upgrade your shoe game today. Discover the perfect pair - don't wait!",clothes
Varsity jacket," A sporty, casual jacket also known as a letterman jacket, featuring contrasting sleeves and ribbed cuffs and hem.",Introducing the Varsity Jacket - Sporty & Stylish! Experience ultimate comfort and a timeless look with our contrasting sleeves & ribbed detailing. Make every day a statement. Step up your game today!,clothes
Asymmetrical dress," A dress with an uneven hemline or design, creating visual interest and balance.",Discover the perfect blend of style & comfort with our Asymmetrical Dresses! Turn heads with unique hemlines & designs that create visual intrigue - Shop Now & redefine your fashion game!,clothes
Wingtip shoes," Classic dress shoes featuring a pointed, decorative toecap design.","Discover timeless elegance with our Classic Wingtip Shoes. Step into luxury with a pointed, decorative toecap design, perfect for upgrading your formal attire. Get yours today!",clothes
Distressed jeans," Jeans that have been deliberately frayed or ripped for a grungy, casual look.",Discover edgy style with our Distressed Jeans collection! Unleash your inner rebel with expertly frayed & ripped designs. Elevate your casual look today! Shop now!,clothes
Ankle boots," Versatile boots that reach the ankle and can be worn with jeans, skirts or dresses.","""Step into style with our versatile Ankle Boots! Perfect with jeans, skirts, or dresses. Elevate your look & walk confidently. Shop now: [website link] #AnkleBoots #FashionStatement""",clothes
Boyfriend blazer," An oversized, loose-fitting blazer for a casual, sophisticated look.","Introducing the Boyfriend Blazer: Effortlessly chic, oversized, and perfect for any occasion. Add a sophisticated touch to your wardrobe for a casual, trendy look. Comfort meets style. Shop now!",clothes
Ruched-top dress," A dress featuring gathering of fabric at the top, which provides a flattering and form-fitting silhouette.","Reveal your captivating charm in our Ruched-Top Dress! Tailored for perfection, this form-fitting silhouette accentuates your curves with its flawlessly gathered fabric. Be the ultimate enchantress!",clothes
Denim jacket," A classic, versatile jacket made from durable denim fabric.",Introducing our Classic Denim Jacket - Timeless style meets unbeatable durability! Perfect for any wardrobe. Upgrade yours & transform any outfit instantly. Get yours now! bit.ly/denim-jacket,clothes
Ruffleneck sweater," A sweater featuring a large, oversized collar that adds warmth and a statement to the garment.",Discover our Ruffleneck sweater - a perfect blend of style and warmth! Stay cozy in a bold oversized collar that elevates your winter wardrobe. Shop now for a statement piece that turns heads!,clothes
Longline cardigan," A knee-length cardigan, perfect for layering and adding extra warmth.","Upgrade your wardrobe with our stylish Longline Cardigan! Knee-length, versatile & perfect for layering, it brings extra warmth to any outfit. Don't let the cold cramp your style - shop now!",clothes
Lace-up sandals," Shoes featuring laces or ties that wrap around the foot and, in some cases, the ankle.",Introducing our latest Lace-up Sandals - where style meets comfort! Wrap your feet in chic designs and experience unbeatable support. Perfect for summer strolls & beachside bliss. Shop now!,clothes
