product,description,ad,category
Cat Scratching Post,A sturdy scratching post to keep your cat's claws healthy and your furniture safe.,"Save your furniture with our Cat Scratching Post – durable, stylish, and perfect for keeping your cat entertained. Shop now and keep your home scratch-free!",pets
Dog Harness,A comfortable and adjustable harness for safe and secure walks.,"Walk your dog in comfort with our Dog Harness – adjustable, secure, and perfect for all sizes. Shop now and enjoy stress-free walks!",pets
Pet GPS Tracker,A GPS device to track your pet's location in real-time.,"Never lose your pet again with our Pet GPS Tracker – real-time tracking, lightweight, and perfect for adventurous pets. Shop now and keep your furry friend safe!",pets
Pet Grooming Kit,"A complete kit with brushes, combs, and nail clippers for pet grooming.","Keep your pet looking their best with our Pet Grooming Kit – complete, easy to use, and perfect for all grooming needs. Shop now and pamper your pet!",pets
Dog Life Jacket,A buoyant life jacket for safe swimming and water activities.,"Keep your dog safe in the water with our Dog Life Jacket – buoyant, adjustable, and perfect for swimming. Shop now and make a splash!",pets
Cat Tree,"A multi-level cat tree with platforms, scratching posts, and hiding spots.","Give your cat the ultimate playground with our Cat Tree – multi-level, sturdy, and perfect for climbing and scratching. Shop now and keep your cat entertained for hours!",pets
Pet Camera,A camera with two-way audio to monitor and interact with your pet remotely.,"Stay connected with your pet using our Pet Camera – two-way audio, real-time monitoring, and perfect for peace of mind. Shop now and keep an eye on your furry friend!",pets
Dog Bed,A comfortable and orthopedic bed for your dog's rest and relaxation.,"Give your dog the comfort they deserve with our Dog Bed – orthopedic, supportive, and perfect for a good night's sleep. Shop now and let your dog dream in comfort!",pets
Pet Water Fountain,A flowing water fountain to keep your pet hydrated and entertained.,"Keep your pet hydrated with our Pet Water Fountain – flowing, filtered, and perfect for encouraging drinking. Shop now and make hydration fun!",pets
Pet Stroller,A lightweight and foldable stroller for transporting small pets.,"Take your pet on the go with our Pet Stroller – lightweight, foldable, and perfect for small dogs and cats. Shop now and enjoy walks together!",pets
Dog Training Clicker,A clicker for positive reinforcement during dog training sessions.,"Train your dog with ease using our Dog Training Clicker – simple, effective, and perfect for positive reinforcement. Shop now and make training fun!",pets
Cat Litter Box,A spacious and odor-control litter box for your cat's hygiene.,"Keep your home fresh with our Cat Litter Box – spacious, odor-control, and perfect for your cat's needs. Shop now and maintain a clean environment!",pets
Pet Cooling Mat,A cooling mat to keep your pet comfortable during hot weather.,"Keep your pet cool with our Pet Cooling Mat – self-cooling, portable, and perfect for hot days. Shop now and beat the heat!",pets
Dog Toy Set,A set of durable and interactive toys to keep your dog entertained.,"Keep your dog entertained with our Dog Toy Set – durable, interactive, and perfect for playtime. Shop now and make every day fun!",pets
Pet First Aid Kit,A comprehensive kit with essential supplies for pet emergencies.,"Be prepared for any situation with our Pet First Aid Kit – comprehensive, portable, and perfect for emergencies. Shop now and keep your pet safe!",pets
Cat Window Perch,A window-mounted perch for your cat to enjoy the view and sunlight.,"Give your cat the best seat in the house with our Cat Window Perch – sturdy, easy to install, and perfect for bird-watching. Shop now and let your cat enjoy the view!",pets
Dog Raincoat,A waterproof raincoat to keep your dog dry during wet weather.,"Keep your dog dry with our Dog Raincoat – waterproof, adjustable, and perfect for rainy walks. Shop now and stay stylish in any weather!",pets
Pet Hair Remover,A tool for easily removing pet hair from furniture and clothing.,"Say goodbye to pet hair with our Pet Hair Remover – easy to use, effective, and perfect for keeping your home clean. Shop now and enjoy a hair-free environment!",gaming
Gaming Mouse,A high-precision mouse designed for gaming with customizable buttons and RGB lighting.,"Dominate the game with our Gaming Mouse – high-precision, customizable, and perfect for every gamer. Shop now and take your gameplay to the next level!",gaming
Mechanical Keyboard,A durable keyboard with mechanical switches for fast and responsive typing.,"Type and play like a pro with our Mechanical Keyboard – responsive, durable, and perfect for gaming. Shop now and feel the difference!",gaming
Gaming Headset,A comfortable headset with surround sound and a noise-canceling microphone.,"Immerse yourself in the game with our Gaming Headset – crystal-clear sound, noise-canceling mic, and perfect for long sessions. Shop now and hear every detail!",gaming
Gaming Chair,An ergonomic chair designed for long gaming sessions with lumbar support.,"Game in comfort with our Gaming Chair – ergonomic, adjustable, and perfect for long sessions. Shop now and stay comfortable while you play!",gaming
Gaming Monitor,A high-refresh-rate monitor with low response time for smooth gameplay.,"Experience smooth gameplay with our Gaming Monitor – high refresh rate, low response time, and perfect for competitive gaming. Shop now and see the difference!",gaming
RGB Lighting Kit,A set of RGB lights to customize your gaming setup with vibrant colors.,"Light up your gaming space with our RGB Lighting Kit – customizable, vibrant, and perfect for creating the ultimate gaming atmosphere. Shop now and set the mood!",gaming
Game Controller,A responsive and ergonomic controller for PC and console gaming.,"Take control with our Game Controller – responsive, ergonomic, and perfect for all your favorite games. Shop now and enhance your gaming experience!",gaming
Gaming Desk,A spacious desk designed for gaming setups with cable management features.,Organize your gaming setup with our Gaming Desk – spacious,gaming
External Hard Drive,A high-capacity drive for storing games and media with fast transfer speeds.,"Expand your storage with our External Hard Drive – high-capacity, fast, and perfect for gamers. Shop now and never run out of space!",gaming
Gaming Mouse Pad,"A large, smooth surface mouse pad with RGB lighting for precise control.","Enhance your precision with our Gaming Mouse Pad – large, smooth, and perfect for every gamer. Shop now and take control of your game!",gaming
VR Headset,A virtual reality headset for immersive gaming experiences.,"Step into another world with our VR Headset – immersive, high-quality, and perfect for gaming. Shop now and experience the future of gaming!",gaming
Capture Card,A device for recording and streaming gameplay from consoles and PCs.,"Share your gameplay with our Capture Card – high-quality, easy to use, and perfect for streamers. Shop now and start your streaming journey!",gaming
Gaming Laptop,A powerful laptop designed for gaming with high-performance hardware.,"Game on the go with our Gaming Laptop – powerful, portable, and perfect for all your favorite titles. Shop now and take your games anywhere!",gaming
Cooling Pad,A pad with built-in fans to keep your laptop cool during intense gaming sessions.,"Keep your laptop cool with our Cooling Pad – efficient, portable, and perfect for long gaming sessions. Shop now and prevent overheating!",gaming
Gaming Microphone,A high-quality microphone for clear voice chat and streaming.,"Communicate clearly with our Gaming Microphone – crisp, clear, and perfect for streaming and chatting. Shop now and let your voice be heard!",gaming
Console Charging Station,A station for charging multiple controllers and accessories simultaneously.,"Keep your controllers charged with our Console Charging Station – efficient, compact, and perfect for gamers. Shop now and never run out of power!",gaming
Gaming Glasses,Glasses designed to reduce eye strain during long gaming sessions.,"Protect your eyes with our Gaming Glasses – reduce eye strain, enhance focus, and perfect for long sessions. Shop now and game comfortably!",gaming
Racing Wheel,A steering wheel and pedal set for realistic racing game experiences.,"Feel the thrill of the race with our Racing Wheel – realistic, responsive, and perfect for racing games. Shop now and take the wheel!",gaming
Gaming Backpack,A durable backpack designed to carry gaming laptops and accessories.,"Carry your gear with our Gaming Backpack – durable, spacious, and perfect for gamers on the go. Shop now and keep your setup safe and organized!",gaming
Game Storage Case,A compact case for organizing and protecting game discs and cartridges.,"Keep your games safe with our Game Storage Case – compact, durable, and perfect for organizing your collection. Shop now and protect your games!",gaming
Garden Hose,A durable and flexible hose for watering plants and cleaning outdoor spaces.,"Keep your garden lush with our Garden Hose – durable, kink-resistant, and perfect for all your watering needs. Shop now and make watering a breeze!",garden
Garden Gloves,Comfortable and durable gloves for protecting your hands while gardening.,"Protect your hands with our Garden Gloves – comfortable, durable, and perfect for all gardening tasks. Shop now and garden with confidence!",garden
Garden Tool Set,"A complete set of tools including a trowel, pruner, and weeder for gardening.","Equip yourself with our Garden Tool Set – complete, durable, and perfect for all your gardening needs. Shop now and make gardening easier!",garden
Watering Can,A sturdy and ergonomic watering can for indoor and outdoor plants.,"Water your plants with ease using our Watering Can – sturdy, ergonomic, and perfect for all your gardening needs. Shop now and keep your plants thriving!",garden
Garden Kneeler,A padded kneeler and seat for comfortable gardening.,"Garden in comfort with our Garden Kneeler – padded, versatile, and perfect for long gardening sessions. Shop now and take care of your knees!",garden
Planters and Pots,A variety of stylish and durable planters for indoor and outdoor plants.,"Add style to your garden with our Planters and Pots – durable, stylish, and perfect for all your plants. Shop now and create a beautiful garden space!",garden
Garden Pruner,A sharp and durable pruner for trimming plants and shrubs.,"Keep your plants in shape with our Garden Pruner – sharp, durable, and perfect for precise trimming. Shop now and make pruning easy!",garden
Garden Cart,"A sturdy and portable cart for transporting soil, plants, and tools.","Move your garden supplies with ease using our Garden Cart – sturdy, portable, and perfect for all your gardening needs. Shop now and make gardening more efficient!",garden
Garden Shed,A durable and spacious shed for storing tools and equipment.,"Organize your garden tools with our Garden Shed – durable, spacious, and perfect for all your storage needs. Shop now and keep your garden tidy!",garden
Garden Bench,A comfortable and stylish bench for relaxing in your garden.,"Relax in your garden with our Garden Bench – comfortable, stylish, and perfect for enjoying your outdoor space. Shop now and create a cozy retreat!",garden
Garden Edging,Decorative edging to define garden beds and pathways.,"Define your garden beds with our Garden Edging – decorative, durable, and perfect for creating clean lines. Shop now and enhance your garden's appearance!",garden
Garden Fountain,A decorative fountain to add a soothing water feature to your garden.,"Add a touch of tranquility to your garden with our Garden Fountain – decorative, soothing, and perfect for creating a peaceful atmosphere. Shop now and enjoy the sound of flowing water!",garden
Garden Lighting,Solar-powered lights to illuminate your garden paths and features.,"Light up your garden with our Garden Lighting – solar-powered, energy-efficient, and perfect for creating a magical evening ambiance. Shop now and transform your garden at night!",garden
Garden Trellis,A sturdy trellis for supporting climbing plants and vines.,"Support your climbing plants with our Garden Trellis – sturdy, durable, and perfect for creating vertical gardens. Shop now and add height to your garden!",garden
Compost Bin,A durable bin for composting organic waste and creating nutrient-rich soil.,"Turn your kitchen scraps into gold with our Compost Bin – durable, easy to use, and perfect for creating rich compost. Shop now and enrich your garden soil!",garden
Garden Soil Tester,A tool for testing soil pH and moisture levels to ensure optimal plant growth.,"Ensure your plants thrive with our Garden Soil Tester – easy to use, accurate, and perfect for monitoring soil health. Shop now and give your plants the best care!",garden
Garden Sprinkler,An adjustable sprinkler for efficient watering of lawns and gardens.,"Water your lawn and garden with ease using our Garden Sprinkler – adjustable, efficient, and perfect for all your watering needs. Shop now and keep your garden green and healthy!",garden
Garden Tiller,A powerful tiller for preparing soil and planting beds.,"Prepare your garden beds with our Garden Tiller – powerful, easy to use, and perfect for breaking up soil. Shop now and get your garden ready for planting!",garden
Garden Storage Box,A weather-resistant box for storing garden tools and accessories.,"Keep your garden tools organized with our Garden Storage Box – weather-resistant, spacious, and perfect for all your gardening needs. Shop now and keep your tools safe and dry!",garden
Garden Insect Repellent,A natural repellent to protect plants from pests and insects.,"Protect your plants with our Garden Insect Repellent – natural, effective, and perfect for keeping pests at bay. Shop now and enjoy a healthy, pest-free garden!",garden
Fountain Pen,A high-quality fountain pen for smooth and elegant writing.,"Elevate your writing with our Fountain Pen – smooth, elegant, and perfect for every occasion. Shop now and experience the art of writing!",writing
Leather Journal,A luxurious leather-bound journal for writing and sketching.,"Capture your thoughts in style with our Leather Journal – durable, elegant, and perfect for writers and artists. Shop now and create timeless memories!",writing
Gel Pen Set,A set of vibrant gel pens for colorful and smooth writing.,"Add color to your writing with our Gel Pen Set – smooth, vibrant, and perfect for all your creative projects. Shop now and let your ideas flow!",writing
Desk Organizer,"A stylish organizer for keeping pens, paper, and other stationery in order.","Keep your workspace tidy with our Desk Organizer – stylish, functional, and perfect for all your stationery needs. Shop now and stay organized!",writing
Calligraphy Set,A complete set for beginners and experts to practice calligraphy.,"Master the art of calligraphy with our Calligraphy Set – complete, easy to use, and perfect for creating beautiful lettering. Shop now and start your calligraphy journey!",writing
Mechanical Pencil,A durable and precise mechanical pencil for detailed writing and drawing.,"Write and draw with precision using our Mechanical Pencil – durable, reliable, and perfect for detailed work. Shop now and enjoy consistent performance!",writing
Sticky Notes,"Colorful sticky notes for reminders, notes, and brainstorming.","Stay organized with our Sticky Notes – colorful, versatile, and perfect for reminders and brainstorming. Shop now and keep your ideas in sight!",writing
Writing Pad,A high-quality writing pad with smooth paper for comfortable writing.,"Enjoy smooth writing with our Writing Pad – high-quality, comfortable, and perfect for all your writing needs. Shop now and make every word count!",writing
Ink Refills,Refill cartridges for fountain pens to keep your writing flowing.,"Keep your fountain pen ready with our Ink Refills – compatible, easy to use, and perfect for continuous writing. Shop now and never run out of ink!",writing
Ballpoint Pen Set,A set of classic ballpoint pens for reliable and everyday writing.,"Write with confidence using our Ballpoint Pen Set – reliable, smooth, and perfect for everyday use. Shop now and enjoy effortless writing!",writing
Notebook Stand,A sturdy stand to hold your notebook or tablet at the perfect angle for writing.,"Improve your writing posture with our Notebook Stand – sturdy, adjustable, and perfect for holding your notebook or tablet. Shop now and write comfortably!",writing
Ergonomic Pen,"A pen designed for comfortable writing, reducing hand fatigue.",Write comfortably with our Ergonomic Pen – designed to reduce hand fatigue and perfect for long writing sessions. Shop now and enjoy pain-free writing!,writing
Highlighters,A set of bright highlighters for marking important text and notes.,"Highlight what matters with our Highlighters – bright, smooth, and perfect for marking important text. Shop now and make your notes stand out!",writing
Writing Desk,A compact and stylish desk designed for writing and studying.,"Create your perfect writing space with our Writing Desk – compact, stylish, and perfect for all your writing and studying needs. Shop now and inspire your creativity!",writing
Pencil Case,"A durable and stylish case for organizing pens, pencils, and other stationery.","Keep your stationery organized with our Pencil Case – durable, stylish, and perfect for all your writing tools. Shop now and carry your essentials in style!",writing
Correction Tape,A clean and precise correction tape for fixing mistakes without a mess.,"Fix mistakes with ease using our Correction Tape – clean, precise, and perfect for neat corrections. Shop now and keep your writing flawless!",writing
Writing Planner,A detailed planner to organize your writing projects and deadlines.,"Stay on track with our Writing Planner – detailed, organized, and perfect for managing your writing projects. Shop now and achieve your writing goals!",writing
Pen Holder,A decorative holder to keep your pens and pencils within easy reach.,"Keep your pens and pencils handy with our Pen Holder – decorative, functional, and perfect for your desk. Shop now and add a touch of style to your workspace!",writing
Graph Paper Notebook,"A notebook with graph paper for precise writing, drawing, and planning.",Plan and draw with precision using our Graph Paper Notebook – perfect for detailed work and organized notes. Shop now and bring your ideas to life!,writing
Writing Light,A clip-on light for illuminating your writing area in low-light conditions.,"Write in any light with our Writing Light – adjustable, bright, and perfect for low-light conditions. Shop now and never strain your eyes again!",writing
Makeup Brush Set,A complete set of high-quality brushes for flawless makeup application.,"Achieve a flawless look with our Makeup Brush Set – soft, durable, and perfect for every step of your makeup routine. Shop now and elevate your beauty game!",makeup
Makeup Sponge,A versatile sponge for blending foundation and concealer seamlessly.,"Blend like a pro with our Makeup Sponge – soft, easy to use, and perfect for a flawless finish. Shop now and create a seamless look!",makeup
Cosmetic Bag,A stylish and spacious bag for organizing your makeup and skincare products.,"Keep your beauty essentials organized with our Cosmetic Bag – stylish, spacious, and perfect for travel or everyday use. Shop now and carry your makeup in style!",makeup
Eyelash Curler,A durable eyelash curler for lifting and curling lashes effortlessly.,"Open up your eyes with our Eyelash Curler – easy to use, durable, and perfect for lifting and curling lashes. Shop now and make your eyes pop!",makeup
Makeup Mirror,A lighted mirror with adjustable brightness for perfect makeup application.,"See every detail with our Makeup Mirror – adjustable lighting, portable, and perfect for flawless makeup application. Shop now and light up your beauty routine!",makeup
Makeup Organizer,A multi-tiered organizer for storing and displaying your makeup collection.,"Organize your makeup collection with our Makeup Organizer – stylish, functional, and perfect for keeping everything in place. Shop now and declutter your beauty space!",makeup
Lipstick Holder,A sleek holder for organizing and displaying your lipstick collection.,"Keep your lipsticks organized with our Lipstick Holder – sleek, compact, and perfect for displaying your collection. Shop now and add a touch of elegance to your vanity!",makeup
Makeup Setting Spray,A long-lasting setting spray to keep your makeup fresh all day.,"Lock in your look with our Makeup Setting Spray – long-lasting, lightweight, and perfect for keeping your makeup fresh. Shop now and stay flawless all day!",makeup
False Eyelashes,High-quality false eyelashes for adding volume and length to your natural lashes.,"Enhance your lashes with our False Eyelashes – natural, easy to apply, and perfect for adding volume and length. Shop now and make your eyes stand out!",makeup
Makeup Remover Wipes,Gentle and effective wipes for removing makeup and impurities.,"Remove makeup effortlessly with our Makeup Remover Wipes – gentle, effective, and perfect for all skin types. Shop now and keep your skin clean and fresh!",makeup
Eyebrow Kit,A complete kit with tools and products for shaping and defining eyebrows.,"Define your brows with our Eyebrow Kit – complete, easy to use, and perfect for creating the perfect arch. Shop now and frame your face beautifully!",makeup
Nail Polish Organizer,A stylish organizer for storing and displaying your nail polish collection.,"Keep your nail polish collection organized with our Nail Polish Organizer – stylish, compact, and perfect for easy access. Shop now and add a pop of color to your space!",makeup
Makeup Palette,"A versatile palette with a range of eyeshadows, blushes, and bronzers.","Create endless looks with our Makeup Palette – versatile, pigmented, and perfect for every occasion. Shop now and unleash your creativity!",makeup
Lip Gloss Set,A set of shiny and hydrating lip glosses in various shades.,"Add a touch of shine with our Lip Gloss Set – hydrating, glossy, and perfect for every look. Shop now and make your lips pop!",makeup
Makeup Blotting Papers,Oil-absorbing papers for keeping your skin matte and fresh throughout the day.,"Control shine with our Makeup Blotting Papers – lightweight, effective, and perfect for keeping your skin matte. Shop now and stay fresh all day!",makeup
Makeup Brush Cleaner,A gentle cleaner for keeping your makeup brushes hygienic and soft.,"Keep your brushes clean with our Makeup Brush Cleaner – gentle, effective, and perfect for maintaining hygiene. Shop now and extend the life of your brushes!",makeup
Makeup Primer,A smoothing primer for creating a flawless base for your makeup.,"Prep your skin with our Makeup Primer – smoothing, long-lasting, and perfect for a flawless base. Shop now and make your makeup last all day!",makeup
Cosmetic Fridge,A mini fridge for storing skincare products and keeping them fresh.,"Keep your skincare fresh with our Cosmetic Fridge – compact, stylish, and perfect for storing your favorite products. Shop now and pamper your skin!",makeup
Makeup Pencil Sharpener,A durable sharpener for keeping your makeup pencils precise and ready to use.,"Keep your makeup pencils sharp with our Makeup Pencil Sharpener – durable, easy to use, and perfect for precise application. Shop now and stay ready for every look!",makeup
Makeup Brush Holder,A stylish holder for keeping your makeup brushes organized and within reach.,"Organize your brushes with our Makeup Brush Holder – stylish, functional, and perfect for keeping your tools in place. Shop now and add a touch of elegance to your vanity!",makeup
Cement,A high-quality cement for strong and durable construction.,"Build with confidence using our Cement – strong, durable, and perfect for all your construction needs. Shop now and lay a solid foundation!",construction
Bricks,Durable and uniform bricks for building walls and structures.,"Create sturdy structures with our Bricks – uniform, durable, and perfect for any construction project. Shop now and build with quality!",construction
Plywood Sheets,High-quality plywood sheets for construction and furniture making.,"Construct with precision using our Plywood Sheets – strong, versatile, and perfect for building and crafting. Shop now and bring your projects to life!",construction
Steel Rebar,Reinforcing steel bars for adding strength to concrete structures.,"Strengthen your concrete with our Steel Rebar – durable, reliable, and perfect for reinforcing structures. Shop now and ensure your construction stands the test of time!",construction
Roofing Shingles,Durable and weather-resistant shingles for roofing.,"Protect your home with our Roofing Shingles – durable, weather-resistant, and perfect for any roof. Shop now and keep your home safe and dry!",construction
Insulation Material,High-performance insulation for maintaining temperature and energy efficiency.,"Keep your home comfortable with our Insulation Material – energy-efficient, easy to install, and perfect for all climates. Shop now and save on energy costs!",construction
Drywall Sheets,Lightweight and easy-to-install drywall sheets for interior walls and ceilings.,"Finish your interiors with our Drywall Sheets – lightweight, easy to install, and perfect for smooth walls and ceilings. Shop now and create a polished look!",construction
